user_input,retrieved_contexts,response,reference,faithfulness,answer_relevancy,context_recall
我们公司今年的年假规定是什么？,"['序号: 140222\n批准文号: 国药准字B20050025\n产品名称: 冠心保软胶囊\n剂型: 胶囊剂\n规格: 每粒装0.45g\n上市许可持有人: 天年药业（哈尔滨）有限公司\n生产单位: 天年药业(哈尔滨)有限公司\n药品编码: 86907795000010\n药品编码备注:', '序号: 88665\n批准文号: 国药准字H19980120\n产品名称: 盐酸特比萘芬凝胶\n剂型: 凝胶剂\n规格: 10克：0.1克\n上市许可持有人: 保定天浩制药有限公司\n生产单位: 保定天浩制药有限公司\n药品编码: 86902551000174\n药品编码备注:', '序号: 17970\n批准文号: 国药准字H20083724\n产品名称: 复方酮康唑软膏\n剂型: 软膏剂\n规格: 复方\n上市许可持有人: 保定天浩制药有限公司\n生产单位: 保定天浩制药有限公司\n药品编码: 86902551000181\n药品编码备注:', '序号: 58277\n批准文号: 国药准字Z13021217\n产品名称: 万氏牛黄清心片\n剂型: 片剂\n规格: 每片重0.3g\n上市许可持有人: 保定中药制药股份有限公司\n生产单位: 保定中药制药股份有限公司\n药品编码: 86902561000638\n药品编码备注:']",根据提供的上下文信息，其中仅包含药品的批准文号、产品名称、生产单位等药品注册相关内容，未涉及任何公司的年假规定信息，因此无法回答该问题。,应提及年假天数、申请流程和特殊规定,1.0,,0.0
解释一下什么是RAG,"['序号: 112657\n批准文号: 国药准字Z21020573\n产品名称: 牛黄清心丸(局方)\n剂型: 丸剂(大蜜丸)\n规格: 每丸重3g\n上市许可持有人: \n生产单位: 沈阳天益堂中药厂\n药品编码: 86901327000486\n药品编码备注:', '序号: 140907\n批准文号: 国药准字Z20026945\n产品名称: 保真膏\n剂型: 膏药\n规格: 每张净重15g\n上市许可持有人: \n生产单位: 哈药集团世一堂制药厂\n药品编码: 86903696000074\n药品编码备注:', '序号: 144134\n批准文号: 国药准字Z23020542\n产品名称: 天王补心丸\n剂型: 丸剂(大蜜丸)\n规格: 每丸重9g\n上市许可持有人: \n生产单位: 哈药集团世一堂制药厂\n药品编码: 86903693002149\n药品编码备注:', '序号: 97033\n批准文号: 国药准字Z23020203\n产品名称: 牛黄清心丸\n剂型: 丸剂(大蜜丸)\n规格: 每丸重3g\n上市许可持有人: \n生产单位: 哈药集团世一堂制药厂\n药品编码: 86903709001272\n药品编码备注:']",根据提供的上下文信息，无法回答关于“RAG 定义 检索增强生成”的问题。上下文中仅包含药品的批准文号、产品名称、剂型、规格、生产单位等信息，未涉及相关定义内容。,应解释RAG的核心思想：检索+生成,1.0,,0.0
帮我把‘公司报销政策’和‘出差申请流程’这两个文档的内容总结一下,"['序号: 160736\n批准文号: 国药准字H22023429\n产品名称: 羧甲司坦\n剂型: 原料药\n规格: ----\n上市许可持有人: \n生产单位: 长春大政药业科技有限公司\n药品编码: 86903304001943\n药品编码备注:', '序号: 58277\n批准文号: 国药准字Z13021217\n产品名称: 万氏牛黄清心片\n剂型: 片剂\n规格: 每片重0.3g\n上市许可持有人: 保定中药制药股份有限公司\n生产单位: 保定中药制药股份有限公司\n药品编码: 86902561000638\n药品编码备注:', '序号: 88665\n批准文号: 国药准字H19980120\n产品名称: 盐酸特比萘芬凝胶\n剂型: 凝胶剂\n规格: 10克：0.1克\n上市许可持有人: 保定天浩制药有限公司\n生产单位: 保定天浩制药有限公司\n药品编码: 86902551000174\n药品编码备注:', '序号: 52124\n批准文号: 国药准字Z13022052\n产品名称: 清咽丸\n剂型: 丸剂（大蜜丸）\n规格: 每丸重6g\n上市许可持有人: 保定中药制药股份有限公司\n生产单位: 保定中药制药股份有限公司\n药品编码: 86902561000515\n药品编码备注:']",根据提供的上下文文档内容，其中仅包含国产药品的编码本位码信息（如批准文号、产品名称、剂型、生产单位等），未涉及“公司报销政策”“出差申请流程”相关内容，因此无法总结相关文档内容。,应分别总结两个文档的核心内容,0.5,,0.0
